{"$id":"https://github.com/GeorgiiMakarov/LIGHTWEIGHT-XR-CONTENT-ENGINE/blob/main/schemas/character-pack.schema.json","$schema":"https://json-schema.org/draft/2020-12/schema","additionalProperties":false,"description":"Strict contract for one character content pack for QAZBOT robots. A pack is authored by the robot owner (or QAZBOT), validated against this schema, and distributed to the fleet. The robot's own AI layer owns voice, facial mimicry and motion; the pack only declares WHAT to show and WHEN: states bound to read-only Genie Studio Agent events, per-surface presentation (built-in facial display and/or XR glasses overlay), and voice lines in the pack locales for the robot's TTS. Static content by design: no per-viewer personalization inside the pack, no biometric processing.","properties":{"assets":{"description":"Content-addressed asset manifest. Every referenced asset must be listed with its sha256.","items":{"additionalProperties":false,"properties":{"asset_id":{"pattern":"^[a-z0-9_]{1,64}$","type":"string"},"bytes":{"minimum":0,"type":"integer"},"kind":{"enum":["expression_clip","glb_bundle","audio","image","xr_clip"]},"sha256":{"pattern":"^[0-9a-f]{64}$","type":"string"},"uri":{"description":"Asset location. pack:// URIs resolve inside the distributed pack; file:// URIs are checked by the validator.","type":"string"}},"required":["asset_id","uri","sha256","kind"],"type":"object"},"type":"array"},"character":{"additionalProperties":false,"properties":{"created_date":{"format":"date","type":"string"},"description":{"maxLength":500,"minLength":1,"type":"string"},"designer":{"description":"Author/studio of the character design.","type":"string"},"name":{"description":"Display name of the character (original design, no third-party IP).","maxLength":64,"minLength":1,"type":"string"},"original_design":{"const":true,"description":"Attestation that the character is an original design and does not reproduce third-party IP (names, likeness, silhouettes). Must be true for distribution."},"persona":{"description":"Short persona brief for the robot's local AI (tone, role, taboos). Plain text, no instructions to the AI layer beyond persona.","maxLength":2000,"type":"string"}},"required":["name","description","original_design","designer","created_date"],"type":"object"},"fallback_state":{"description":"State id used when a trigger has no mapping or an asset fails to load. Must reference an existing state (checked by the validator).","type":"string"},"locales":{"description":"Locales the pack ships voice lines for. The robot's TTS synthesizes them.","items":{"enum":["kk","ru","en"]},"minItems":1,"type":"array","uniqueItems":true},"pack_id":{"description":"Stable pack identifier. Never reused for a different character.","pattern":"^pack_[a-z0-9_]{1,64}$","type":"string"},"pack_version":{"description":"Semver of the pack content. Robots pull updates by version.","pattern":"^(0|[1-9]\\d*)\\.(0|[1-9]\\d*)\\.(0|[1-9]\\d*)$","type":"string"},"provenance":{"description":"Optional addendum A1: origin of the avatars (generation jobs, platform terms evidence, similarity screening, human review). Validated by tools/validate_xr_layer.py against schemas/xr-layer.addendum.schema.json.","type":"object"},"spec_version":{"const":"v1","description":"Pack spec version. Validators refuse packs on mismatch."},"states":{"description":"Playable states of the character. Each state is entered on a read-only Genie Studio Agent event and never writes back to the robot.","items":{"additionalProperties":false,"properties":{"facial":{"additionalProperties":false,"properties":{"base_expression":{"description":"Fallback base expression if the clip is missing.","enum":["neutral","happy","attentive","concerned","proud"]},"expression_clip":{"description":"asset_id of the expression clip played on the built-in facial display.","type":"string"}},"type":"object"},"id":{"pattern":"^[a-z_]{1,32}$","type":"string"},"timing":{"additionalProperties":false,"properties":{"duration_ms":{"minimum":100,"type":"integer"},"fade_in_ms":{"default":0,"maximum":2000,"minimum":0,"type":"integer"},"fade_out_ms":{"default":0,"maximum":2000,"minimum":0,"type":"integer"},"loop":{"default":false,"type":"boolean"}},"required":["duration_ms"],"type":"object"},"trigger":{"description":"Read-only Genie Studio Agent event that enters this state (e.g. genie.idle, genie.visitor_detected). Provisional names until QAZBOT confirms the event catalog.","pattern":"^genie\\.[a-z_]{1,64}$","type":"string"},"voice_lines":{"additionalProperties":{"items":{"maxLength":500,"minLength":1,"type":"string"},"minItems":1,"type":"array"},"description":"Per-locale spoken lines for this state. Synthesized by the robot's own TTS; the pack carries text, not audio.","propertyNames":{"enum":["kk","ru","en"]},"type":"object"},"xr":{"additionalProperties":false,"properties":{"animation":{"description":"Named baked animation inside the bundle (e.g. Appear, Idle, React).","type":"string"},"bundle_asset":{"description":"asset_id of the GLB bundle rendered in XR glasses.","type":"string"},"despawn_at_ms":{"minimum":0,"type":"integer"},"fade_in_ms":{"default":0,"maximum":2000,"minimum":0,"type":"integer"},"spawn_at_ms":{"default":0,"minimum":0,"type":"integer"}},"type":"object"}},"required":["id","trigger","timing"],"type":"object"},"minItems":1,"type":"array"},"target_surfaces":{"description":"facial_display = the robot's built-in facial screen (base layer, every robot has it). xr_glasses = optional premium AR overlay for visitors with smart glasses.","items":{"enum":["facial_display","xr_glasses"]},"minItems":1,"type":"array","uniqueItems":true},"xr_layer":{"description":"Optional addendum A1: XR layer over a moving robot (tiers, registration, safety, disclosure). Validated by tools/validate_xr_layer.py against schemas/xr-layer.addendum.schema.json. A pack without it is a plain v1 pack.","type":"object"}},"required":["spec_version","pack_id","pack_version","character","locales","target_surfaces","fallback_state","states","assets"],"title":"QAZBOT Character Pack v1","type":"object"}