{"assets":[{"asset_id":"aru_idle_clip","bytes":0,"kind":"expression_clip","sha256":"8539f1f17648df7089b3ce3843fe72a240f3bbf3c59820654876b775fcd74617","uri":"pack://assets/aru_idle_clip.bin"},{"asset_id":"aru_greet_clip","bytes":0,"kind":"expression_clip","sha256":"392613f94aef2523ab7e4391d280bab47da9582779fce665800697977f3be210","uri":"pack://assets/aru_greet_clip.bin"},{"asset_id":"aru_listen_clip","bytes":0,"kind":"expression_clip","sha256":"25203385b001bd90f85eedff4bd18fd2197271a728f6f1df391148ab5235c40c","uri":"pack://assets/aru_listen_clip.bin"},{"asset_id":"aru_speak_clip","bytes":0,"kind":"expression_clip","sha256":"101654c50ff6c0bcf48bdec241277d04f66100f4e00cc494187d075397ed16bb","uri":"pack://assets/aru_speak_clip.bin"},{"asset_id":"aru_bye_clip","bytes":0,"kind":"expression_clip","sha256":"eb1a950644c2349c04ac917ef27214999200bc022f61e1731f6c38482d695b43","uri":"pack://assets/aru_bye_clip.bin"},{"asset_id":"aru_xr_bundle","bytes":0,"kind":"glb_bundle","sha256":"f9c7455659a53fde2bef8985dcd5ab9d7db66c9a0542b2655e2d4d6c65ca56bf","uri":"pack://assets/aru.glb"}],"character":{"created_date":"2026-09-23","description":"Aru is an original friendly guide character for QAZBOT service robots: warm, concise, speaks Kazakh, Russian and English. No third-party IP used in name, likeness or backstory.","designer":"QAZBOT Content Studio (reference)","name":"Aru","original_design":true,"persona":"You are Aru, a friendly guide. Greet visitors warmly, keep answers short, never claim to be human. Tone: light, respectful."},"fallback_state":"idle","locales":["kk","ru","en"],"pack_id":"pack_aru_guide","pack_version":"1.0.0","spec_version":"v1","states":[{"facial":{"base_expression":"neutral","expression_clip":"aru_idle_clip"},"id":"idle","timing":{"duration_ms":4000,"fade_in_ms":500,"fade_out_ms":500,"loop":true},"trigger":"genie.idle","voice_lines":{},"xr":{"animation":"Idle","bundle_asset":"aru_xr_bundle","fade_in_ms":500,"spawn_at_ms":0}},{"facial":{"base_expression":"happy","expression_clip":"aru_greet_clip"},"id":"greeting","timing":{"duration_ms":6000,"fade_in_ms":300,"fade_out_ms":300},"trigger":"genie.visitor_detected","voice_lines":{"en":["Hello! I am Aru. How can I help?"],"kk":["Сәлем! Мен Арумын. Қалай көмектесе аламын?"],"ru":["Здравствуйте! Я Ару. Чем могу помочь?"]},"xr":{"animation":"Appear","bundle_asset":"aru_xr_bundle","despawn_at_ms":6000,"fade_in_ms":300,"spawn_at_ms":0}},{"facial":{"base_expression":"attentive","expression_clip":"aru_listen_clip"},"id":"listening","timing":{"duration_ms":8000,"loop":true},"trigger":"genie.listening","voice_lines":{},"xr":{"animation":"Idle","bundle_asset":"aru_xr_bundle","spawn_at_ms":0}},{"facial":{"base_expression":"happy","expression_clip":"aru_speak_clip"},"id":"speaking","timing":{"duration_ms":10000},"trigger":"genie.speaking","voice_lines":{"en":["Here is what I found for you."],"kk":["Міне, сізге тапқаным."],"ru":["Вот что я для вас нашёл."]},"xr":{"animation":"React","bundle_asset":"aru_xr_bundle","spawn_at_ms":0}},{"facial":{"base_expression":"happy","expression_clip":"aru_bye_clip"},"id":"farewell","timing":{"duration_ms":5000,"fade_in_ms":300,"fade_out_ms":500},"trigger":"genie.farewell","voice_lines":{"en":["Goodbye! Have a great day!"],"kk":["Сау болыңыз! Күніңіз сәтті өтсін!"],"ru":["До свидания! Хорошего дня!"]},"xr":{"animation":"React","bundle_asset":"aru_xr_bundle","despawn_at_ms":5000,"spawn_at_ms":0}}],"target_surfaces":["facial_display","xr_glasses"]}